item_id,title
356891,India cricket team will not play a bilateral series with Pakistan: Sports minister Vijay Goel
363576,India get solid workout in rout of Bangladesh
393109,India Launches Its Most Muscular Rocket Yet: Foreign Media
364378,India players reportedly 'intimidated' by coach Kumble 
402525,India to get another 'eye in the sky' by month-end
384349,India vs Pakistan - ICC Champions Trophy: 5 key player battles in mega-clash
439035,India vs Pakistan in ICC knockout matches: A brief history
393305,India Wants Apple to Create Jobs in Exchange for Tax Breaks: Report 
435188,India Will Play Against Pakistan On Sunday No Matter What Happens Today
389639,India's Bid To Join Nuke-Club NSG Has Become 'More Complicated' Says China
351879,India's Sexiest Man 'Milind Soman' Has Found New Love In This Young & Beautiful Lady!
416821,Indian Army Has Shot Down 13 Terrorists Who Were Trying To Cross LoC In The Last 96 Hours
329409,Indian Army strikes Pakistan posts along LoC in Jammu and Kashmir releases video of assault
384605,Indian Cricket Team Hotel In Birmingham Under Lockdown After London Attacks
448500,Indian Fathers Who Raise Strong Independent Women Are The Heroes We Need Today
426803,Indian national coaches won't be allowed to coach IPL sides anymore according to new BCCI directives
402786,Indian-American Among 12 New Astronauts Chosen By NASA From Over 18000 Applicants
3956,INDvsBAN: बांग्लादेश पर बड़ी जीत के साथ फाइनल में टीम इंडिया अब पाक से टक्कर
318769,Is Aamir Khan celebrating Dangal's success in China with these dance moves? - View HQ pics
380459,Is Katrina Kaif's midnight gym session anything to do with her IIFA performance? See photo
367352,Is This Superstar Now Dating This Supermodel?
376403,Is This Why Kareena Kapoor Khan Skipped Karan Johar's Birthday Bash?
439601,ISIS Chief Bagdadi May Have Died Claims Russian Military
407533,ISIS Says It Killed Two Chinese Teachers Kidnapped In Pakistan
348277,It Looks Like Ranveer Singh & Deepika Padukone Are Living Together
3966,J&K: श्रीनगर के हैदरपुरा में नमाज़ के बाद पुलिस जवानों पर आतंकी हमला एक जवान शहीद
376059,Jagga Jasoos song Ullu Ka Pattha: Ranbir Kapoor Katrina Kaif shot this song after break-up
450125,Jaitley announces GST roll-out on June 30 midnight; rates fixed for hotels lottery
376058,Jat Sikh From Punjab Commits Suicide After He Discovers His Wife's Mother Is A Dalit
417213,Jayalalithaa's niece Deepa Jayakumar brother Deepak fight over Poes Garden house target Sasikala
3892,JEE Advanced Result 2017: आलू बेचने वाले के बेटों का हुआ IIT में सेलेक्शन
323179,Jinder Mahal beats Randy Orton to win WWE Championship at Backlash
445112,K Srikanth Stuns World No. 1 Son Wan Ho To Enter Indonesia Open final
444162,Kalki Koechlin Looks Like A Doll In This Ruffle Dress
385840,Kamal Hassan Slams 28% GST On Regional Cinema Says He Might Quit Films
425417,Kangana Ranaut-Hrithik Roshan Rekha-Amitabh Bachchan: Actors who will never work together again
411723,Kansas Man Who Killed Indian Engineer Srinivas Kuchibhotla Charged With Hate Crime
393311,Kapil Sharma wants Sunil Grover to return to show- Here's a proof
430076,This Virat Kohli Painting Sold For A Whopping $3.7 Million Dollars At His Charity Dinner
370548,This Woman's Hair-Art Is Undoubtedly Fabulous - She Literally Turns Hair Into A Work Of Art!
366379,To Avoid Irking China India Won't Include Australia In Naval Drills
393107,Top 7 Indian Outsourcing Companies Got Fewer H-1B Visas In 2016: Report
442955,Top Lashkar Terrorist Junaid Mattoo Killed In Jammu And Kashmir Encounter Say Police
374915,Tremors felt again in Haryana's Rohtak after 5.0 magnitude rattles Delhi adjoining areas
426150,TV Actress Kritika Chaudhary Found Dead At Her Apartment In Mumbai
30139,TV Icon Ankita Lokhande Signs Her First BollywoodÂ Film Opposite This Actor
403078,Uber Fires Executive Who Allegedly Obtained 2014 Delhi Rape Victim's Medical Records
358493,Umesh Yadav posts pic of dine-out with Virat Kohli and Indian teammates
444926,UP Govt's Order To Dissolve Waqf Boards Is Illegal & Undemocratic Says Azam Khan
361425,UP Minister Swati Singh Seen At Beer Bar Opening Yogi Adityanath Seeks Report
3838,UP: किसानों की कर्जमाफी के लिए साढ़े 16 हजार करोड़ रुपए का कर्ज लेगी योगी सरकार- सूत्र
371160,UPSC Civil Services Result Declared! Here's Who The Next IAS Or IPS Would Be!
389809,Van Driver's Daughter Scores Full Marks In 10th Studies In The Same School Where Her Dad Works
370140,Victoria & Abdul: The Story Of An Unlikely Friendship Between The Queen & Her Indian Servant
450124,Vidya Balan's Adorable Father's Day Message For Her Dad Is A Tribute To Fathers Everywhere
387797,Vijay Mallya spotted at India-Pakistan Champions Trophy game in Birmingham
394506,Vijay Mallya Went To Kohli's Charity Ball Only To Be 'Ignored' By Indian Team
442951,Violence rocks Kashmir: 6 policemen shot dead in LeT ambush 2 civilians killed in clashes with securitymen
442951,Violence rocks Kashmir: 6 policemen shot dead in LeT&#8201;ambush 2 civilians killed in clashes with securitymen
380644,Virat Gets Candid About Everything From Being A Feminist To How Anushka Changed Him As A Person
361429,Virat Kohli 'unhappy' with Anil Kumble BCCI's Big 3 to broker peace?
403076,Virat Kohli Is The Only Indian In List Of Top 100 Highest Paid Sports Stars In The World
426992,Virat Kohli Signs Another Mega-Bucks Contract After 100-Crore Puma Deal
426857,Virat Kohli Shah Rukh Salman Khan among Forbes' 100 highest paid celebrities in the world
380266,Virat Kolhi's Diet: The Simple Regime Behind An Extraordinary Athlete
397957,Virender Sehwag Sends Two-Line Application For Coaching Job
361757,Vivek Oberoi revisits his infamous fight with Salman Khan and we can't help but love his sense of humour
391104,Wahab ruled out of Champions Trophy with ankle injury
394703,Want to be a part of Salman Khan's Bigg Boss 11? Here is your chance to win the golden ticket 
426175,Was In Tears When I Shared Captaincy News With Anushka: Virat Kohli
353674,Way Before Dhinchak Pooja It Was 'Emotional Atyachaar' That Made Cringe Mainstream
348868,We Tried Decoding The Genres Of Bollywood Films & Turns Out It Wasn't That Difficult
398512,Wedding Photo Of Kerala Left Leader's Daughter Is Viral. Party Displeased
428485,What's At Risk If Triple Talaq Is Declared Unconstitutional
352861,When Kapil Sharma decided to keep quiet on a plane
362903,When Priyanka Chopra met PM Narendra Modi in Berlin
376395,Why Anil Ambani Is Richer Even After $513 Million Telecom Wipeout
422333,Will Deepika Padukone Star In P.V. Sindhu's Biopic?
370343,With 1080 aircraft orders India to be 3rd largest buyer of passenger planes
393304,Woman Allegedly Gang Raped 9-Month-Old Daughter Thrown Off Moving Auto In Gurgaon
446311,World Cricket's Biggest Match to Decide Champions Trophy Title
387795,World Environment Day: Despite increasing green cover India is losing its forests
362581,World No Tobacco Day: 9 Health Consequences of Smoking You Need to Know
389476,Wounded Tigers Bangladesh Eyeing Strong Comeback Against Australia
422318,WTF Freaky Trend &#8211; Black Tapes Are Replacing Clothes Of Women !
415623,Xi Jinping Snubs Nawaz Sharif After 2 Chinese Teachers Killed In Pakistan
426177,Yoga for Double Chin: An Inexpensive Way to Lose That Extra Facial Chub
385293,Your Baby's Teeth Can Predict the Risk of Autism?
387790,Yuvraj's innings changed the match - Kohli 
3210,अगर 10 मिनट में राष्ट्रपति ट्रंप ने ये निर्णय नहीं किया तो फिर अमेरिका का बचना मुश्किल है ! 
3692,अगर आपका भी पेट बार बार फूलता है तो आपको ये 7 बीमारियाँ हो सकती है !
3092,अगर आपकी राशि है ये तो लड़कियाँ आपको घास भी नहीं डालेंगी 
1682,अगर सुबह चाहिए परफेक्ट बाल तो रात को अवश्य करें ये काम 
3772,अगले 1000 सालों में इन्सान कैसा दिखेगा ये विडियो आज ही देख लो तो अच्छा है!
1678,अचानक से लड़की नज़र अंदाज़ करने लगे तो फिर क्या करे ! 
3374,अनिल कपूर की ये दिलचस्प लवस्टोरी यकीनन आपने पहले कभी नहीं सुनी होगी ! 
2972,अपनी गर्लफ्रेंड की राशि जानकर इस तरह उसे कर सकते हैं उत्तेजित ! 
3630,अपनी राशि अनुसार चुनें अपना करियर
3658,अपने होने वाले पति से हर लड़की पूछना चाहती है ये सवाल !
3872,अब 'परी' बनकर लोगों को डराएंगी अनुष्का शर्मा फिल्म का फर्स्ट लुक रिलीज देखें
1606,अब तो चीन ने भी मान लिया कि 2024 तक मोदी से भिड़ने की न सोचे क्योंकि 
3572,अब फ़िल्मी पारी की शुरुआत करेंगे धोनी जानिये किस फ़िल्म से उतरेंगे सिल्वर स्क्रीन पर !
3724,अब महिलाओं को दी जायेगी खड़े होकर टॉयलेट करने की ट्रेनिंग जानिए क्यों?
3260,अबराम के पिता शाहरुख़ नहीं बल्कि आर्यन है ! 
2808,अभिनेत्रियों के हाथ पर थूकने के पीछे आमिर खान बताते हैं यह टोटका ! 
3594,अभिषेक और ऐश्वर्या की खुली पोल लाख-छिपाने पर भी सब असलियत जान गई बेटी !
3924,अमिताभ ने कभी दी थी अनिल कपूर को ये नसीहत जिसे आज भी वो करते हैं फॉलो !
2322,अमेरिका की धमकी अब इस देश को दुनिया के नक़्शे से मिटने से कोई नहीं रोक सकता है 
3452,अमेरिका के इन शहरों की बदनाम गलियाँ जहाँ पर होते हैं गंदे काम !
3372,अमेरिकी खुलासा पाक को सबक सिखाने के लिए मोदी करने जा रहे हैं अब ये काम 
3506,अरबपतियों की बेटियाँ जीती है ऐसी लाइफ !
3918,अर्जुन रामपाल की 'डैडी' का आज आएगा ट्रेलर 21 जुलाई को होगी रिलीज फिल्म
1664,अलग-अलग देशो में लड़कियों की सुन्दरता के पैमाने आपको हैरान कर देंगे! 
407359,Raabta movie review LIVE: Sushant Singh Rajput Kriti Sanon Jim Sarbh make this story work
398510,Rani Mukherjee Is Giving Tough Competition To Ranveer! Can't Imagine An Actress Dressing So Weirdly
398330,14 Years Old Boy Given Zero In All Subjects! The Reason Will Surely Make You Furious!
427220,Meet This Noida Family That Has Nine Full-Time YouTubers Including An 8-Year-Old Girl
434390,Modi Govt's Cow Slaughter Ban Is Tearing Apart The Leather Industry Slowly
3942,MP: सिंधिया का 72 घंटे का सत्याग्रह बोले- ‘मैं कुर्सी के लिए ये सब नहीं करता’
381216,Neeraj Chopra Wins Gold Sets New Federation Cup Meet Record
440548,No Matter How Much Fancy Footwear I Own My Chappals Will Always Be My Favourite
389153,Never start gymming without proper guidance from an expert. It could cost your life
381022,One Fact Which Shows That India Are Simply Better Than Pakistan
3136,लड़कों को पसंद आते हैं अपनी गर्लफ्रेंड के ये झूठ 
430631,'YHM' actress Karishma Sharma to star in Ekta Kapoor's web series 'Ragini MMS 2.2
442957,[PHOTOS] Ranbir Kapoor and Deepika Padukone party together at Imtiaz Ali's birthday bash
394306,19 Year Old Girl Makes Rich Friends On WhatsApp & Here's What She Does To Them!
333212,6 Seeds You SHOULD Eat Every-Day To Improve Your Health!
439611,A Combination of Vitamin C and Antibiotics Can Kill Cancer Cells More Effectively Say Experts
384943,Aditya Roy Kapur loses a film opposite Alia Bhatt
385641,Katrina Kaif DITCHES her manager Reshma Shetty for Salman Khan
397955,Modi govt gears up for 2019 polls with 'a project a day'
370544,Not Just Arjun Kapoor Salman Khan's Darling Sister Had A Secret AFFAIR With This ""PINK"" Star Too!
3430,कैसा महसूस होता है जब आपको पॉर्न देखने के पैसे मिलते है पढ़िए एक पॉर्न एडिटर की आपबीती
3758,जिन महिलाओं के ये निजी अंग बड़े होते हैं वो कुछ ऐसी होती है !
3504,यहाँ सिर्फ एक सैंडविच के लिए कमसीन लडकियाँ बनाती हैं मर्दों से संबंध !
3810,ये खूबियाँ रखने वाले स्टूंडेंट्स को खुद कॉलेज आकर ले जाती हैं कंपनियाँ !
3334,ये योग्यताएँ हैं तो आप भी बन सकते हैं देश के राष्ट्रपति ! 
3804,ये हैं बॉलीवुड की 5 सुपरहिट माँ और उनकी सुपर फ्लॉप बेटियाँ !
3524,राष्ट्रपति के ड्राईवर से इतिहास के प्रोफेसर बनने की दिलचस्प कहानी
3659,वजन कम करना है तो ज्यादा काम आएगा ये नुस्खा!
3486,विश्व के इस सबसे सस्ते हथियार बाज़ार में खिलोनों के दाम मिलती है असली AK 47
3756,साधारण से दिखनेवाले इस फोन में ऐसी क्या बात है कि इसकी कीमत रखी गई है 2.3 करोड़ !
3716,सेक्स के दौरान बिस्तर पर अक्सर ये 7 गलतियाँ करती हैं महिलाएँ !
3242,…और सलमान की आंखों से छलक ही गया वो दर्द जिसे उन्होंने बरसों तक छिपा रखा था ! 
411717,'God Will Provide' Believe 3 Pakistani Men Who Sired 96 Children
408587,I am happy that Hrithik Roshan is playing me- Anand Kumar
434802,I Have Decided To See To It That He Does Not Get Married A Third Time - Salman Khan On Aamir Khan
380653,[Photos] Hrithik Roshan catches a late night show of Wonder Woman with ex wife Sussanne and kids
3888,1000 औरतों के साथ सोने के बाद भी ये आदमी बदनाम नहीं हुआ !
417412,12 Dangerous Effects Of Bad Sleeping Habits That You Can't Ignore
3508,12 महीनों में कई खास कारणों के लिये जाना जाता है मई का महीना !
366430,14 'Yeh Jawaani Hai Deewani' Dialogues That Prove It's Our Generation's Favourite Coming-Of-Age Film
397951,14-Year-Old Girl Allegedly Gang-Raped In Bus In Tamil Nadu 3 Arrested
440347,24 Years After 1993 Blasts Mastermind Dawood Ibrahim Is Still Absconding. This Is What He May Look Like Now
365977,27-Year-Old PhD Student Found Dead In IIT Delhi Campus
387791,4 Terrorists Killed While Trying To Attack CRPF Camp In Jammu And Kashmir's Bandipora
390131,50 per cent of rape cases in India can be prevented if we build toilets says Akshay Kumar
3698,786 नंबर को आखिर इतनी अहमियत क्यों दी जाती है जानिए इसके पीछे का ये रहस्य !
374910,A Throwback To The 2000 Champions Trophy When Team India Found Its Aggression & Winning Attitude
412475,Aamir Khan in China Shah Rukh Khan in Germany - 7 Bollywood stars who have massive fan following in other countries
389803,Aamir Khan's Dangal is inching towards the Rs 1900 crore mark at the worldwide box office
425415,Aamir Khan's Dangal to receive only 25 per cent revenue from the China box office
376739,Aishwarya Rai lookalike Sneha Ullal left films due to severe illness stayed away for 4 years. See photos
426183,Kapil Sharma's ex-colleague Ali Asgar and ex GF Preeti Simoes join Krushna Abhishek's Comedy Company?
394315,Karnataka: Pregnant Muslim woman stabbed burnt alive for marrying Dalit man
394513,Katrina Kaif makes a sacrifice to let Ranbir Kapoor shine in Jagga Jasoos? This video says so...
380267,Katrina Kaif: Please leave Alia Bhatt for Varun Dhawan and Salman Khan for me!
442953,Kerala Gets Its First Metro In Kochi Today Prime Minister Narendra Modi To Flag Off: 10 Points
402787,Kim Sharma Might Work For Free After Split From Husband Reports Say (Also May Not Be Single)
405970,Kohli credits Sri Lanka for seizing the moment
412846,Kohli Faces His Toughest Test As India Take On South Africa In Do-Or-Die Clash
389477,Less Than 10 Crore Come For Bollywood Over The Weekend At The Box Office
407528,LFC Transfers: Roll Out The Red Carpet Van Dijk Will Be A Liverpool Player!
424213,Maharashtra govt tapping new sources to fund Rs 30000 crore farm loan waiver
367518,Meet ISC Class 12 Topper Ananya Maity! She's Multi-Talented & Doesn't Have A Facebook Account
417803,MS&#8201;Dhoni's unique way of handling pressure in ICC&#8201;Champions Trophy 2017
426181,Narendra Modi's new India vision will help US job creation: Sean Spicer
449117,On President Poll Uddhav Thackeray Rejects Amit Shah Proposal: Sources
430074,Over 13 Jawans Injured In Series Of Militant Attacks In Kashmir Army On High Alert
390137,Parineeti Chopra and Alia Bhatt hang out with friends
449921,Pictures of Salman Khan with children that prove that he will be a great dad!
407355,PM Modi meets Chinese President Xi Jinping on SCO sidelines
448713,Priyanka Chopra's outfit is proof that she refuses to compromise on her comfort
434392,PWD Slaps AAP With A Fine Of Rs 27 Lakh For 'Unauthorised Occupation' Of Party Office
411715,Raabta box office collection Day 1: Sushant-Kriti's film has a decent opening
413042,Rahul Dravid Responds To Ramachandra Guha's Letter Says Not Under A Conflict Of Interest
384938,Railways Told To Pay Rs 75000 Compensation To Passenger Whose Reserved Seat Was Occupied
371154,Rajasthan HC Judge Asks Govt To Declare Cow As India's National Animal! Here's Why
420992,Rajiv Gandhi's Famous 15 Paise Remark Finds Mention In SC's Order On Aadhaar
375561,Ramachandra Guha's Resignation Letter Questions MS Dhoni Getting Grade A Contract
3676,करोड़ों की कमाई करने के बावजूद बॉलीवुड की ये अभिनेत्रियाँ रहती हैं किराए के घर में !
761,किसान आंदोलन: शिवराज आज उपवास पर बैठेंगे मंच सजा नए-नए कूलर लगे शौचालय बना
3848,कॉलेस्ट्रॉल कम करने से लेकर पिंपल्स भी दूर कर सकती है गाजर!
3568,क्या आप अपने चेहेते सितारों के इन भाई-बहनों से कभी मिले हैं !
4034,क्यों रहती है आपकी जेब हमेशा पैसों से खाली ?
2602,खुल रहा है ऐसा रेडलाइट एरिया जहाँ रोबोट होंगी कॉलगर्ल ! 
3094,घंटो बैठकर काम करने को मजबूर हैं तो सेहत के लिए अपनाइए ये उपाय ! 
3944,जब 8 किमी पैदल चलकर शेरा ने सलमान को निकाला था सुरक्षित !
3870,जानें- सोनम कपूर ने ऐसा क्या किया जो उनसे नाराज हो गए अमिताभ बच्चन!
3736,जीन्स के नये ट्रेंड में ‘ प्लास्टिक जीन्स ’ को क्या आपने मारकेट में देखा है?
3726,बॉलीवुड का ये सिरफिरा अभिनेता लड़का हो या लड़की हर किसी को जबरदस्ती करता है किस !
3520,बॉलीवुड का ये हीरो फिल्मों में आने से पहले लोगों के घरों पर वॉचमैन था ?
3972,बॉलीवुड की इन बेमेल जोड़ियों को देखकर आप भी कहेंगे ‘ओ माई गॉड’
3516,ब्रेकअप के बाद आज भी प्रियंका ने संभालकर रखी है एक्स-बॉयफ्रेंड की ये खास चीज !
3812,ब्वॉएज़ ट्रिप पर जाने के लिए गर्लफ्रेंड से ऐसे लें परमिशन
2866,ब्वॉयफ्रेंड की फैमिली को इंप्रेस करना आसान बात नहीं है। 
3864,भारत से भिड़ने से पहले बांग्लादेशी कप्तान मुुर्तजा ने कहा हम बिना चिंता के खेलना चाहते हैं
3628,भारत-पाकिस्तान बंटवारे के ये 7 फैक्ट आज भी ज्यादातर भारतीयों को नहीं पता है।
3898,मर्द क्‍यों करते हैं बीवी से तकरार और गर्लफ्रेन्ड से प्‍यार !
3492,यही है वो गुफा जहाँ शिव के रुद्रावतार हनुमान जी ने लिया था जन्म !
3728,ये टॉप की अभिनेत्रियाँ जो कभी नहीं खाती नॉनवेज !
3834,ये हैं मर्दों की वो 6 अहम बातें जिनसे जल्दी पट जाती हैं लडकियाँ !
3534,ये हैं यूपी बिहार की खूबसूरत अभिनेत्रियाँ जिन्होंने बॉलीवुड में मचाया धमाल !
3936,रोमांस के मामले में इन राशियों की लडकियाँ होती हैं चंचल !
3514,वह धर्म जिसमे होती है सेक्स की पूजा बड़े-बड़े हॉलीवुड स्टार हैं इसके अनुयायी !
3570,विराट कोहली और अनिल कुंबले के बीच पड़ गई है दरार जानिए क्या है वजह?
3704,वैसे तो ऐश्वर्या किसी से नहीं डरती लेकिन इस बात से उन्हें लगता है सबसे ज्यादा डर !
3814,शादी के कार्ड में वर-वधु के नाम के आगे चिरंजीव और आयुष्मती लिखने के पीछे ये है असली वजह !
3620,शादी से पहले सेक्स पर श्रीदेवी के इस बयान को सुनकर आप अपनी हंसी नहीं रोक पायेंगे !
3820,श्रीराम के भक्त हनुमानजी ने किए थे तीन विवाह फिर भी कहलाये बाल ब्रह्मचारी !
3654,सनी लियोनी की हॉट अदाओं को तो आपने बहुत देखा अब देखिए सनी का देसी जानलेवा लुक को!
