item_id,title
3598,सलमान खान के कहने पर इस अभिनेत्री ने पार कर दी थी बोल्डनेस की सारी हदें !
3762,सलमान खान ने जब अभिषेक के सामने किया ऐश्वर्या को किस तो जानिए क्या हुआ !
260,साल बदले या शताब्दी आपकी आने वाली पीढ़ी भी इन 10 चीजों को ऐसे ही देखेगी! 
3642,हाथ से निकल जाए नौकरी तो करें ये काम !
396550,'Australia at its best in knockout situations' - Starc
362901,'Baahubali' Prabhas to marry industrialist's granddaughter?
421877,'Bank Chor' Sounds Like Behen***d Says Censor Board Asks The Makers To Redo The Title
430823,'Daddy': Arjun Rampal becomes fifth Indian actor to launches movie trailer at Google headquarter
449316,'Harry Potter' Actor Sam Beazley Dies At The Age Of 101
356481,'Isn't this our country?' Why Muslims in Uttar Pradesh feel shaken 'harassed'
427075,'Keep Dreaming About Billions Of Pounds': Vijay Mallya Outside UK Court
439605,'No More Jobs In Qatar': Indian Workers On Gulf Crisis Frontline
374911,'Not Renegotiable': European Leaders Slam US For Exiting Climate Deal
402523,'Plastic Rice' Being Sold In Hyderabad? Samples Sent For Testing
444169,'What is going to happen to me the first night in my grave?' Slain Kashmir cop's Facebook post haunts Anantnag
3564,'नहीं रहे शाहरुख खान'... ये जानकर ही पुलिस ने दम लिया! 
3646,‘योगी और मोदी’ की इन समानताओं के बारे में आप बिलकुल भी नहीं जानते होंगे!
376738,10 Cult Raj Kapoor Films That Prove He Truly Was The Showman Of Hindi Cinema
353464,15 Bollywood Actors Who've Aged Like Fine Wine
429686,15 Empowering Quotes From Successful Entrepreneurs That Are All The Motivation You Need
450122,18 Years On True Mature Love As Shown In 'Hum Dil De Chuke Sanam' Still Remains Relevant
3690,1841 से इस सीरियल किलर के सर को रखा गया है सुरक्षित -इसके पीछे बेहद अजीब कारण है
3974,1993 मुंबई ब्लास्ट में अबु सलेम सहित 6 दोषी सलेम को नहीं हो सकती फांसी
448712,20 Memorable Photos From India-Pakistan Matches To Get You Ready For The Final
384604,20 Photos That Prove You Don't Need A Field To Play Cricket You Just Need A Bat & Ball
428483,200 Firefighters Battle Massive Blaze At London High-Rise
3828,2030 तक धरती पर नहीं बचेंगे ये 5 देश !
375554,23-Yr Delhi Techie Allegedly Shot Dead By Boyfriend! Murder Caught On Camera!
394866,3-Year-Old Girl Allegedly Raped By Her School Director Parents File FIR
4006,30 की उम्र से पहले करोड़पति बनने के 9 करियर ऑप्शन्स
425978,4 Kg Heroin 3 Kg Smack AK-47 All Seized From Punjab CIA Inspector's House
445186,5 Women Reveal Truth About Their Experience Of A Live-in Relationship
379269,50 fake online orders in 4 months: Gang of teenagers robbing delivery boys in Delhi arrested
434598,7 Questions That Annoy Every Tattooed Woman In India
415641,8 Must-Have Essentials For Monsoon Season
430630,9 Kashmiri Students Crack JEE Advanced All Thanks To An Indian Army Initiative
413036,90 Per Cent Of Pickpockets In Delhi Metro Are Women Gangs Says CISF Data
332,90 के दशक में कई हिट फिल्में देने वाले राजेश खन्ना के जीवन पर एक नज़र 
433391,A Serial Loser A Couple From Mumbai.... See Who Is Running For President
413051,Aadhaar Must For Filing Tax Returns New PAN From July 1: Government
411699,Aadhaar to be linked to PAN but SC wants safeguards relaxed penalties: All you need to know
422176,AB de Villiers Got Really Emotional After Losing To India & Says SA Can Still Win World Cup
426179,Adding Red Onions to Your Daily Diet May Help Combat Cancer
390130,Afridi Is Super Impressed With India's Victory & Very Unhappy With Pakistan's Performance
422025,After 'world's largest beach clean-up' Versova gets a coconut lagoon
403080,After Embarrassing Pakistan India Look To Punish Familiar Foes Sri Lanka In Champions Trophy
398513,After Gang-Rape Gurgaon Woman Travelled To Hospital On Metro Holding Dead Baby
440346,After Termination Of Over 60000 Employees IT Forum Seeks Help From State Govts
430812,Ahead of Champions Trophy Semis Virat Kohli Regaining His No 1 ODI Rank Is Exactly What Team India Needs
362905,Air India In Multiple Scams Says CBI. Here's What It's Investigating
426537,Akhilesh Yadav's 'Hidden Face' On School Bags In Gujarat Baffles Many
413040,Akshay And Twinkle's Luxurious Home Will Make You Envious !
417455,Akshay Kumar and Ajay Devgn: A 25-year old Bollywood rivalry almost too subtle to notice
417805,Akshay Kumar and Bhumi Pednekar's this still from Toilet Ek Prem Katha made us impatient for the trailer
362371,Akshay Kumar shares a perfect solution to reduce rape percentage in India
376564,Akshay Kumar&#8217;s Embarrassing First Love-Story Is So Damn Relatable!
376229,Alia Bhatt opens up on link-up rumours with Sidharth Malhotra
324987,Alia Bhatt Was Denied Entry Into A Bar For Looking Too Young
347657,Baahubali 2 (Hindi): 5th Friday Box Office Collections
767,BANvsNZ: बड़ा उलटफेर कर बांग्लादेश ने न्यूज़ीलैंड को टूर्नामेंट से किया बाहर
338447,BCCI invites applicants for Team India coach Anil Kumble a direct entry
30151,Did You Know That Armaan Kohli Physically Tortured THIS Tarak Mehta Actress In Their Relationship?
439609,Ladies Just 30 Minutes of Exercise Can Make You Feel Positive
379267,Leo Varadkar: Born to an Indian father a historic gay PM for Ireland
375360,Let's Be Honest Wanderlust Is Probably The Most Overrated Social Media Trend Ever
448513,Lovebirds Alia Bhatt and Sidharth Malhotra in work mode - view pics
401137,Madhya Pradesh farmers protest LIVE: DM SP removed Rahul Gandhi leaves for Mandsaur
417809,Maharashtra Announces Loan Waiver For Farmers After Days Of Protests
411721,Mahatma Gandhi Was 'Chatur Baniya' Wanted Congress Dissolved: Amit Shah
399196,Mamta Kulkarni & Husband Vicky Goswami Declared As Offenders In Drug Haul Case By Thane Court
417614,Man For The Big Occasion: Shikhar Dhawan Always Saves His Best For Major Tournaments
385301,Man Got 44th Rank In UPSC & Rejected Rs 22 Lakh Offer From Amazon! Reason Will Make You Respect Him
403444,Man Was Taking Drugs In Public Toilet. When Caretaker Stopped Him He Killed Her 21-Yr Son
420997,Mandsaur agitation: How demonetisation brought MP farmers onto streets
440349,Meet Rishi Shah an Indian-American college dropout who is Chicago's latest billionaire
440348,Mohammad Amir likely to be fit for final
367516,New Rule By Government! Mobile Number Will Be Deactivated If Not Linked To Aadhaar Card!
433393,Nitish Kumar Asks Yogi Adityanath To Not Come To Bihar 'Empty-Handed'
426173,No meat no sex pure thoughts: Modi ministry's prescription to pregnant women for healthy baby
403446,North Korea Fires Another Salvo Of Missiles Defying International Condemnation
379265,Not One Bullet Fired In 40 Years Despite Border Dispute With China: PM Modi
405975,Oh No! Here's Some Sad News For All You Kareena Kapoor Fans
417210,On Suggestion Of Chief Justice Delhi HC Starts Yoga Classes Ahead Of International Yoga Day
445114,One More Farmer Commits Suicide In Madhya Pradesh Death Toll Rises To 12
445115,Pakistan bowlers will realise the importance of controlling Virat Kohli on Sunday: AB de Villiers
429689,Pappu Slur Acted On Quickly But Abusing Army Chief Isn't Says BJP
427218,Patna's Super 30 Does It Again All 30 Students Clear IIT-JEE Advanced Exam This Time
370141,Paul Allen Just Rolled Out The World's Largest Airplane
405973,PM Narendra Modi Greets Nawaz Sharif To Meet China's Xi Jinping Today: 10 Points
383403,Police Say 6 People Slain In 'Terrorist Incidents' On London Bridge And In Nearby Market
366988,Priyanka Chopra Reveals What Really Matters When Choosing A Partner
434393,Qatar Signs $12 Billion Deal For US F-15 Jets Amid Gulf Crisis
389807,Qatar's dispute with Arab states lifts oil prices may impact LNG supplies
422327,Raees Director Opens Up About SRK Intolerance And Much More
444165,Rahul Dravid: Can't think of an all-time India XI without Yuvraj Singh
403445,Rahul Gandhi Detained On Way To Violence-Hit Mandsaur In Madhya Pradesh
440345,Rajinikanth-Akshay Kumar's 2.0 bagged by Baahubali 2 distributor
445681,Ranbir Kapoor on nepotism: Of course it exists I want to ensure my kids get the right first film
412659,Ranbir Kapoor Varun Dhawan and Aditya Roy Kapur bring in the weekend with Karan Johar - view HQ pics
385113,Ranveer Singh is 'missing' Deepika Padukone. Is this finally an acknowledgement of their relationship? See photo
421195,Ranveer Singh rejects a film with Katrina Kaif because of girlfriend Deepika Padukone?
295608,Rishabh Pant Didn't Get Picked For Champions Trophy But He's Got Dravid's Stamp Of Approval
3650,कपिल शर्मा अपने शो में इन सितारों को बुला बुलाकर थक चुके हैं लेकिन ये सितारें है कि…!
3800,काजोल के मना करने के बाद भी आखिर क्यों उनके सामने शर्टलेस हो गए थे सलमान
3440,कुछ इस तरह शुरू हुई थी विराट और अनुष्का की लव स्टोरी !
3732,कुछ ऐसी थी प्रियंका गाँधी और रॉबर्ट वाड्रा की लव स्टोरी!
3448,कुछ ऐसी थी सोनाली बेंद्रे और राज ठाकरे की अधूरी प्रेम कहानी !
3840,कृति सैनन ने चार सालों में की हैं सिर्फ तीन फिल्में जानें इस धीमी शुरूआत पर क्या है उनका कहना
3680,क्या आप जानते है पाकिस्तान में भारतीय जासूसी के ये चर्चित मामले ?
320,क्या आप जानते हैं लिवइन रिलेशनशिप को लेकर लड़कों की क्या सोच होती है?
3604,क्या आपको पता है आलिया भट्ट का ये बाथरूम सीक्रेट?
236,क्या आपको पता हैवकील काला कोट ही क्यों पहनते हैं? 
1882,क्या बिस्तर में ‘Size’ से फर्क पड़ता है? 
3694,क्यों भाई-बहन जैसे दिखने लग जाते हैं पति-पत्नी?
3794,क्यों सिर्फ मर्द ही होते हैं गंजे औरतें नहीं !
4024,खुल गया राज़ 19 साल पहले सलमान ने आखिर क्यों उतारी थी शर्ट !
3468,गंगा नदी को इस वजह से बांधना पड़ा था शिव को अपनी जटाओं में!
3916,गर्भवती महिलाओं को सरकार की सलाह 'सेक्स से रहें दूर न खाएं अंडा'
3510,गर्मी के मौसम में ये है भारत के सबसे पसंदीदा टूरिस्ट प्लेस !
3662,गर्मीयों में इन पांच तरह के कपड़ों से दूर रहे वरना शरीर में हो सकता है इंफेक्शन !
3644,गुरुवार को पीला रंग पहनने के फायदे जानकर हैरान रह जाएंगे आप !
3272,गूगल पर गलती से भी पोर्न मूवीज सर्च करना खतरनाक साबित हो सकता है ! 
3376,चीन की गलियों में लग रहे हैं ऐसे पोस्टर जिसे पढ़ने के बाद लोग अमेरिकी से दूर भाग रहे हैं 
3512,चीन में पढ़ाई करना चाहते हैं तो करें ये काम
3388,चुपके-चुपके रतन टाटा चला रहे हैं ये छोटे स्टार्ट अप्स
3754,जब पाकिस्तान में एक मुस्लिम लड़की लगाती है बिंदी तो उसके साथ होता है कुछ ऐसा…!
3830,जब महिला रिपोर्टर के सामने दबंगई दिखाते हुए सलमान खान करने लगे इस काम की जिद !
2266,जलियांवाला बाग़ की दर्द भरी कहानी आपको पढ़नी चाहिए उस दिन की पूरी कहानी 
376,जवानी बरक़रार रखता है शकरकंद रोज़ाना सेवन करने से होंगे कई लाभ
3682,जानिए आखिर किस वजह से अमिताभ बच्चन ने राजनीति से तौबा कर ली थी!
3350,जानिए एक वैश्या और एक भिखारी की इमोशनल प्रेम कहानी! 
3684,जानिए कितना फर्क है भारत के कश्मीर और पाक अधिकृत कश्मीर में!
3798,जानिए किस वजह से हनुमान ने लिया था पंचमुखी हनुमान रूप!
3928,जानिए पांडवों से विवाह के पहले कौन था द्रौपदी का असली प्रेम !
3816,जानिये क्यों रेग्युलर कॉलेज से बेहतर है डिस्टेंस एजुकेशन से पढ़ाई करना !
1526,जानें क्यों अजीत डोभाल हैं देश के सबसे बड़े जासूस 
3982,जिम करते समय लड़कियों को इन 5 बातों का रखना चाहिए ध्यान
3774,जिस जॉब का सपना देखते हैं उसे पूरा करने के लिए करें ये काम !
3906,जुलाई तक किसानों की कर्ज माफी लागू नहीं हुई तो उठाएंगे बड़ा कदम- उद्धव ठाकरे
3608,बॉबी देओल को पहली नजर में हुआ था तान्या आहूजा से प्यार ! ऐसे शादी में तब्दील हुई ये लव स्टोरी !
3398,बॉलीवुड के इन एक्टर्स की ये न्यूड तस्वीरें हो चुकी हैं वायरल क्या आपने देखी !
3760,बॉलीवुड के टॉप स्टार की वैनेटी वैन फाइव स्टार होटल के रूम से बेहतर है !
3500,बॉलीवुड के ये सितारे जब बन गए अपने पड़ोसियों के लिए सबसे बड़ी मुसीबत !
2584,बॉलीवुड के सेलिब्रिटीज करते हैं अपनी नौकरानियों से इतना गंदा बर्ताव कि…! 
3994,बॉलीवुड में आने से पहले ही किसके सपने देख रही हैं श्रीदेवी की बेटी जान्हवी ?
3266,ब्रेकअप का गम भूलाने के लिए ज्यादातर लडकियाँ इन 7 कामों को करना पसंद करती हैं 
3418,ब्रेकअप हो जाने के बाद भी सपने में एक्स आता है तो उसके ये कारण हो सकते है!
2865,ब्रेस्ट कैंसर से बचने के लिए फूड!
2074,भगत सिंह की फांसी से खफा होकर 26 जनवरी को सुभाष च्रंद्र बोस ने यहां फहराया था तिरंगा 
3744,भारत का यह गाँव है एशिया का सबसे साफ-सुथरा गाँव जिसे कहा जाता है भगवान का बगीचा !
3984,भारत की जीत पर सहवाग का ऐलान ‘फादर्स डे पर बेटे के साथ फाइनल है’
4026,भारत के इस शहर में बन रहा है दुनिया का सबसे ऊँचा और अनोखा मंदिर !
3738,भारत के तिरंगे से मिलते-जुलते हैं इन देशों के नेशनल फ्लैग !
3264,भारत ही नहीं बल्कि विदेशो में भी इन सितारों ने खरीद रखे हैं आलिशान बंगले ! 
3914,भारत-चीन युद्ध की वजह से कुंवारे ही रह गए रतन टाटा !
3734,माल्या का विला खरीद चुके एक्टर सचिन जोशी की बिजनेस लाइफ !
3730,मेजर ध्यानचंद ने हिटलर का ऑफर ठुकराते वक्त इतनी बड़ी बात कही थी!
4030,मोटापा कम करना है तो करें ये आसन! 
3710,मोदी और ट्रंप नेता है दो लेकिन इनकी कहानी एक सी है!
3596,मोदी से लेकर जुकरबर्ग तक जानिए कितनी देर सोते हैं दुनिया के सबसे कामयाब लोग !
3790,मोहम्मद अली जिन्ना ने एक बच्ची से शादी क्यों की थी!
3686,यह है विराट कोहली का फिटनेस सीक्रेट जो आप जरुर जानना चाहेंगे !
3546,यूपी के इस मंदिर में इश्क से छुटकारा पाने के लिये की जाती है पूजा !
3938,यूपी: ABP की खबर पर मुहर योगी ने माना- 'तय समय में पूरा नहीं हुआ गड्ढ़े भरने का वादा'
4022,ये 5 क्रिकेटर गेंदबाज बनने आये थे लेकिन बन गए टॉप क्लास बल्लेबाज!
3640,ये कलाकार ब्रश के बजाय जीभ से बनाता है पेंटिंग !
3672,ये पुलिसवाला खाली वक्त में चलाता है ऑटो वजह जानकर आप भावुक हो जायेंगे!
3610,ये शख्स ट्विटर पर फॉलो करने वालों को देगा 5 लाख रूपये !
3208,ये स्टार किड्स है अपने माँ-बाप के हमशक्ल तस्वीरे देखकर हैरान रह जाओगे! 
4010,ये हेयरस्टाइल बनाने पर आप दिखेंगी 10 साल जवान !
3550,ये है बॉलीवुड की टॉप टेन अमीर एक्ट्रेसेस जिनके पास है बेशुमार दौलत !
3600,ये हैं विटामिन D से भरपूर 10 आहार
3850,योग ने बदली जिंदगीः योगा से स्लीप डिस्क से लेकर माइग्रेन तक हो गया ठीक!
3718,रक्तदान जरूर कीजिए क्योंकि इससे होते हैं ये बेमिसाल फायदे !
3976,राष्ट्रपति चुनाव: सोनिया से मिली शाह की टीम कांग्रेस बोली- BJP के पास कोई नाम नहीं उल्टा हमसे पूछा
324,रोज भीगे हुए बादाम खाने के हैं अनेक फायदे इन्हें जानना होगा आपके लिए फायदेमंद 
3854,लड़कों की इन आदतों से लड़कियों को होती है नफरत !
3990,लोगों को बोर कर हर महीने इतने कमा लेती है ढिंचैक पूजा !
1745,वजन कम करने के लिए खाएं फ्लैक्स सीड्स!
3934,विदेश में कॉलेज चुनते समय ध्यान रखें ये बातें
3862,विराट कोहली की कमाई जानकर आपका दिमाग चकरा जायेगा !
4004,विराट कोहली को इस क्रिकेटर ने मारे थे थप्पड़ !
170,वीरान इलाकों में बने इन बेहद खूबसूरत घरों में रहना किसी ज़न्नत से कम नहीं 
2560,श्रद्धा कपूर को सुनसान आईलैंड पर ले जाना चाहते हैं ये भारतीय क्रिकेटर ! 
3890,श्रीलंका के खिलाफ कैमरे ने पकड़ी पाकिस्तानी कप्तान सरफराज़ की बेईमानी
3526,संजय लीला भंसाली से नाराज होकर पद्मावती के सेट से भागे रणवीर ले सकते हैं ये गंभीर फैसला
3896,सभी चाहते हैं भारत और इंग्लैंड के बीच फाइनल हो: विराट कोहली
3946,सरकारी नौकरी और प्राइवेट नौकरी दोनों के है अपने अपने फायदें इनमें से आप क्या चुनेंगे!
3612,सरकारी नौकरी चाहते हैं तो भूलकर भी ये गलतियाँ ना करें !
3490,सलमान खान और अरबाज खान के बीच ये बन गई हैं कलह का कारण !
3996,सारा के डेब्यू पर बोले पापा सैफ- कोई भी पैरेंट अपने बच्चों के लिए ऐसी जिंदगी नहीं चाहेगा
4018,सावधान ! हद से ज्यादा सेक्सुअली एक्टिव लोगों को हो जाती है ये खतरनाक बीमारियाँ !
3788,सिर्फ 20 दिन की शादी में 19 साल लग गए तलाक लेने में !
3826,सुपरस्टार रजनीकांत प्रणब मुखर्जी के बाद बन सकते है अगले राष्ट्रपति!
494,सुहाना को डेट करने के रूल्स शाहरुख़ की बेटी को डेट करना है तो ये रूल्स
3764,सेक्‍स लाइफ बेहतर करने के लिए ये व्यायाम है अचूक उपाय !
3940,सेमीफाइनल के महामुकाबले में आज भारत और बांग्लादेश होंगे आमने-सामने
3076,स्मृति ईरानी की सौतेली बेटी से शाहरुख खान का है ये इमोशनल कनेक्शन ! 
