item_id,title
449323,So in how many movies have Shah Rukh Khan Salman Khan Akshay Kumar played papas? We tried to solve that for you
358287,So who's going to romance Hrithik in Krrish 4?
426746,Sonali Raut Trying To Lock Lips With This Ex Bigg Boss Contestant! Pic Has Taken Internet By Storm!
397950,Sonia Gandhi Might Step Down As Congress President In October Paving Way For Rahul
421575,Sonia Gandhi Should Apologise Says Minister On 'Goonda' Comment For Army Chief
319767,Soon Anti-Diabetes Drugs to Replace Painful Insulin Jabs
353462,South Africa Called Out For Ball-Tampering Again & AB De Villiers Is Very Very Upset About It
351745,Space Garbage In Orbit Makes Leaving Earth Much More Dangerous
353669,SPOTTED: Hrithik Roshan goes for a movie with ex wife Sussanne and kids check pic
407873,Starting Next Month Tax Returns Need Aadhaar ID Says Supreme Court
439613,Submit Aadhaar Else You Can't Operate Bank Accounts. Deadline Announced
443958,Surprise Your Dad In Style With These Unique Father's Day Gifts Ideas
422331,Sushant Singh Rajput's Response On Raabta Receiving A Thumbs Down At The Box Office
438831,Tech Savvy ISIS Chief Recruiter In India Named Global Terrorist By US
362574,Tejas Express To Replace Its Rs 200 Headphones With Rs 30 Ones After Losing 337 Of Them
439425,Terrorist Abu Salem Convicted In 1993 Mumbai Blasts Case
370546,The ""Kind Of Person"" You Want In Your LIFE According To Your Zodiac Sign!
408554,The Controversial Buffalo Race Kambala Will Soon Be Legalised. Here's All You Need To Know
439423,The Crazy New Way This Start-Up Raised $153 Million In Just Three Hours
252225,The Health Risk of Working Night Shifts: It May Affect Your Liver!
407531,The Kapil Sharma Show makes it to the Top 5 with Kumkum Bhagya and Naagin 2 check out top 10 shows
448915,The Kapil Sharma Show: Diljit Dosanjh rocked the show with his innocence humour and singing
339048,The Legacy Of Sachin: Shouldering A Billion Dreams & Making Them Come True
430816,The New 'Spider-Man' Game Looks Straight Out Of A Movie And We Can't Get Enough Of The Graphics
362579,The Power of Rose: It Can Prevent Wrinkles Acne and Inflammation
357882,The Story Of Javed Miandad's Last-Ball Match-Winning Six Against India In 1986
420994,The Trailer Of 'Toilet - Ek Prem Katha' Looks Like An Extended Swachh Bharat Abhiyan TVC
434388,These 'Gadar' Memes Are So Funny They'll Even Get Angry Sunny Paaji To Crack Up!
344068,These 10 Most Sexiest Men Of Asia Are Too Hot To Handle !
408404,These 10 Motivational Songs Will Brim You With Enthusiasm
408402,These 10 Pick Us Lines Are So Raunchy That He Will Be On His Knees!
426842,These B-Town Celebs Don&#8217;t Drink Alcohol In Real Life And The Reason Behind It Makes Sense!
329002,These Photos Of Nawazuddin As Manto Are Keeping Our Faith In Cinema Alive
370752,These Reel-Life Mom-Son Jodis Actually Share A Huge Age Difference In Real-Life 
394515,This Bollywood Actor Might Play Alia Bhatt's Husband In An Upcoming Thriller
351869,This Bollywood Actor Shaved Half His Head For His Next Series
366984,THIS Bollywood Actress Just Revealed That She Is OK With Having A Baby Before Getting Married!
422329,This ex-Bigg Boss contestant just SLAMMED Katrina Kaif for using excessive make up to look ageless
343875,This Famous Bollywood Singer Rejected Madhuri Dixit's Arranged Marriage Proposal
394106,This Girl Made Her Dad Proud With Her Result In The Same School Where He Is A Van Driver
398850,This Gujarat Boy Scored A 99.9 Percentile In Class 12 Boards & Left It All To Become A Jain Monk
338446,This Gurugram Woman Has Started A One-Of-A-Kind Bakery For Dogs & Your Pooch's Going To Love It
363066,This Is A Sad Story Behind ""How Jackie Shroff Turned Into Jaggu Dada"" In His LIFE!
366986,This Is A Sad Story Behind ""How Jackie Shroff Turned Into Jaggu Dada"" In His LIFE!
309002,THIS Is Sunny Leone's Message For The Wives Of A-List Actors Who Don't Allow Their Husbands To Work With Her!
408396,This Is The Reason Why You MUST Use A Potato Slice To Prevent Dark Circles!
411697,This Is The Reason Why You MUST Use A Potato Slice To Prevent Dark Circles!
358285,This Malaika Arora Shweta Nanda photo from Karan Johar's party is going crazy viral. See it here
435002,This Painting Showing Kohli's IPL Journey Over Last 10 Yrs Is Sold For Whopping Rs 23 Crores!
381031,This small screen industry actress is more sexy than Alia and Deepika
3338,इन पांच चीजों को खाने के बाद भूल ने भी ना करें दूध का सेवन ! 
3706,इन बॉलीवुड अभिनेताओं को उनकी बीवीयों ने मारे हैं सरेआम थप्पड़
3720,इन राशियों के लोग बोलते हैं सबसे ज्यादा झूठ !
3502,इन राशियों के लोग होते हैं इतने दिलफेंक कि इन्हें हो जाता है किसी से भी प्यार !
3542,इन वजहों से बच्चों को इंजीनियर बनाना खतरे से खाली नहीं
3478,इस अभिनेत्री के साथ काम करने से आज भी डरते हैं सलमान खान !
2920,इस एक गिलास जूस से मोटे से मोटे पेट की चरबी हो जायेगी गायब ! 
3988,इस एक बात पर इतनी खफा हैं दिव्यांका त्रिपाठी कि चैनल को दे डाली शो छोड़ने की धमकी !
2606,इस एक शख्स ने दुनिया में महिलाओं को सिखाया था सिगरेट पीना! 
3822,इस एक्टर के कहने पर माधुरी दीक्षित कभी नहीं बन पाई अमिताभ बच्चन की हीरोइन !
3146,इस कश्मीरी युवा के लिए बीएसएफ एग्जाम में टाप करना बन गया खतरे की घंटी ! 
3472,इस कहानी को जानने के बाद आप किस्मत को कोसना छोड़ देंगे!
3970,इस कारण हर तरह की हीरोइन के साथ काम करने को तैयार हो जाते हैं अक्षय कुमार !
3824,इस क्रिकेटर ने खुद किया खुलासा कि वो 500 से भी ज्यादा महिलाओं के साथ…!
4000,इस खबर को पढ़कर आप समझ जायेंगे कि ब्रेकअप के बाद भी कैटरीना को कितना चाहते हैं सलमान !
3370,इस खबर को सच मानें तो कहा जा रहा है कि ऐश्वर्या अभिषेक बच्चन से जल्द ही लेने वाली हैं तलाक ! 
3806,इस खास अंगूठी को धारण करने से धन-सपंत्ति में होती है कमाल की बरकत !
3346,इस खास टोटके की वजह से श्रद्धा कपूर की हर फिल्म होती है हिट-सुपरहिट! 
3618,इस खूबसूरत अभिनेत्री पर जरूरत से ज्यादा ही मेहरबान हो रहे हैं रानी मुखर्जी के पति आदित्य
3922,इस जिम में सिर्फ उन्ही लोगों को एंट्री मिलती है जो बिना कपड़ो के एक्सरसाइज करते है!
3488,इस ट्रिक को आजमाकर छुपा सकते हो अपना असली मोबाइल नंबर !
3474,इस डर के मारे अभिषेक के साथ काम करने से ऐश्वर्या ने किया इनकार
3860,इस तरह हुई थी श्रीराम और लक्ष्मण की मृत्यु !
3312,इस प्रोफ़ेशन के लड़कों से शादी करने के लिए पागल है आज की लडकियाँ ! 
4020,इस मशहूर इंडियन क्रिकेटर ने बॉलीवुड अभिनेत्री को चार साल तक गुलाब भेजे थे !
3776,इस महिला की वजह से टूटी सलमान खान और अक्षय कुमार की बरसों पुरानी दोस्ती !
2750,इस महीने मुलायम सिंह यादव बना सकते हैं नई पार्टी ! 
4032,इस राशि के लोग अपने पार्टनर को पागलों की तरह चाहते हैं !
2952,इस राशिवाले लोगों की जोड़ी होती है बहुत भाग्यशाली ! 
3586,इस वजह से भगवान श्रीराम की एक पत्नी और श्रीकृष्ण की थी 16 हजार पत्नियाँ !
3580,इस वजह से सदियों से सूर्य देव को जल चढाने की चली आ रही है परंपरा !
3552,इस वजह से सहवाग की बीवी ने उन्हे सचिन के प्रीमियर पर नही जाने दिया
3446,इस वजह से हिंदू धर्म में मुंडन संस्कार को दिया जाता है इतना ज्यादा महत्व !
3352,इस वजह से हैकर्स बिटकॉयन वर्चुअल करेंसी में मांगते हैं फिरौती ! 
3456,इस शख्स के लिए राजघराने के सारे ऐशो आराम छोड़ने को तैयार है ये राजकुमारी !
3880,इस शख्स ने प्रियंका को किया इतना मजबूर कि उन्होंने 3 बार की सुसाइड करने की कोशिश !
3638,इस शहर के रेलवे स्टेशन पर ट्रेन रुकते ही पत्नियाँ हो जाती है नौ दो ग्याहरा !
3566,इस श्राप से बचने के लिए हवाई मार्ग से अमरकंटक नहीं गए थे नरेंद्र मोदी !
4028,इंस्टाग्राम पर तापसी पन्नू के 30 लाख फॉलोअर्स
3402,उस रात जब अमेरिका खिड़की खोलकर पाकिस्तान के इस घर में दाखिल हुआ तब…
3661,एक अमरूद दुरुस्त कर सकता है आपकी सेहत!
3808,एक इनिंग में 9 विकेट लेने वाले इस भारतीय गेंदबाज ने क्यों देश छोड़ दिया था!
3578,एक खराब इंटरव्यू भी इस तरह बना सकता है आपको सफल !
3522,एक तांगे वाला कैसे बन गया मसालों की दुनिया का बादशाह?
3498,एक पूरी फिल्म का बजट खर्च हुआ है बॉलीवुड के इन सबसे महंगे गानों पर !
777,एक बार फिर प्रियंका और अक्षय के बीच बढ़ रही है नजदीकियाँ !
3920,एक समय था जब सनी देओल को ‘छोटे पापा’ कहकर बुलाने लगी थी ट्विंकल खन्ना !
3842,एक ही छत के नीचे जिम करने पहुंचे शाहिद-मीरा और करीना कपूर यहां देखें PICS
3768,एक्टिंग के अलावा बॉलीवुड से जुड़े है ये शानदार करियर जिनमें है लाखों की कमाई !
3886,एक्‍टिंग छोड़ अब ये कोर्स करने वाली हैं सनी लियोनी !
3904,एमपी में 19 साल पहले भी कांग्रेस के राज में पुलिस की गोली से मारे गए थे 24 किसान!
3858,एलोवेरा के इन नुकसानों से वाकिफ नहीं होंगे आप !
3884,ऐश्वर्या और अभिषेक अगर ले रहे हैं तलाक तो उसकी सबसे बड़ी वजह है ये महिला !
3450,ऐश्वर्या राय की ये तस्वीरें आपको कर देंगी मदहोश क्योंकि इनमें वो जमकर दिखा रही हैं अपने क्लीवेज !
3544,ऐसी लड़कियों को जल्दी ही मिल जाती है अच्छी नौकरी!
4016,और इस तरह एक कूली ने खड़ा कर दिया 2500 करोड़ का बिजनेस !
3796,आईआईटी स्टुडेंट्स ने बनाया बिना बिजली के चलने वाला एसी !
3328,आखिर ऐसा क्या हुआ जो रातोंरात फिल्म स्टार रजनीकांत के घर पर पुलिस का पहरा बढ़ाना पड़ा 
3626,आख़िर किस बात पर अलग हो गए थे विराट और अनुष्का ?
3548,आखिर कौन सा है वो मंदिर जहाँ बॉलीवुड के शहनशाह कभी काम की फ़रियाद लेकर गए थे?
3366,आखिर क्यों अपनी सगी माँ से दूर और सौतेली माँ के करीब हो रही हैं सारी अली खान ! 
3932,आखिर क्यों डॉक्टरों ने सुनील दत्त को दी अपनी पत्नी नरगिस को मौत के घाट उतारने की सलाह !
3894,आंखों में आंसू के साथ सबसे पहले अनुष्का को बताई थी कप्तानी मिलने की खबर: विराट कोहली
3528,आगरा पुलिस ने पुजारी को दान में दी ऐसी दक्षिणा कि
3782,आज भी बड़ी इज्ज़त से लिया जाता है इन 5 तवायफों का नाम !
3786,आठवीं फेल इस छात्र के इशारे पर चलती है सीबीआई !
3282,आधी-रात को नशे में धुत होकर संजय दत्त ने रितेश और साजिद को बैडरूम में बुलाकर करवाया ये काम 
3852,आपकी किडनी को फेल कर सकती है हर रोज की ये छोटी-छोटी लापरवाही !
3910,आपके भविष्य के बारे में बहुत कुछ बताती हैं हथेली की ये चार रेखायें !
3926,आपके लिए ये काम करता है इंटरनेशनल कोर्ट
3592,आमिर खान से इस खूबसूरत अभिनेत्री ने ऐसे लिया था अपनी बेइज्जती का बदला !
3874,आरबीआई ने फिर से 500 के नए नोट जारी किए पुराने 500 के नोट चलते रहेंगे
2870,आरबीआई में नौकरी पाने के लिए करना पड़ता है ये काम ! 
3770,आर्टिफिशियल इंटेलिजेंस का कोर्स करना चाहते हैं तो बेस्ट हैं ये इंस्टिट्यूटस
3290,आलिया ने बताया कि ये वाला है उनका सबसे फेवरेट सेक्स पोजिशन ! 
3194,इंटरव्यू में सबसे ज्यादा पूछे जाते हैं ये 8 सवाल तो हो जाइए तैयार 
3356,इंटर्नशिप करना चाहते हैं तो बराक ओबामा आप ही को ढूंढ रहे हैं ! 
3954,इंडिया के इस बॉलर ने लगातार 21 ओवर मेडेन फेंके थे!
3634,इतनी सेक्सी है ये हीरोइन कि सरकार ने लगा दिया 1 साल का बैन !
3576,इतिहास की ये शातिर रानियाँ जिन्होंने अपने दम पर पूरी दुनिया पर राज किया !
3664,इन 10 जॉब्स में महिलाओं को मिलती है तगड़ी सैलरी
3746,इन 10 बॉलीवुड सितारों को अंतिम समय में उनके परिवार ने त्याग दिया
3336,इन 12 खतरनाक बिमारियों की एकमात्र दवा है ‘पान’! 
3614,इन 2 तरीकों से कर सकते है एलोवेरा का बिजनेस 10 लाख रुपए तक हर साल होगा इनकम !
3340,इन 2 राशियों के ‘कपल्स’ कभी नहीं होते अलग 
2680,इन 3 राशियों के पुरुष होते हैं ‘बेस्ट हज़्बैंड’ कभी न छोड़ें इनका हाथ 
3952,इन 4 स्त्रियों के अपमान बताते है कि पौराणिक काल में भी प्रचलित था रेप कल्चर !
3602,इन 5 खिलाड़ियों ने अपने दोस्त की गर्लफ्रेन्ड या बीवी से की है शादी !
3722,इन 5 बॉलीवुड सेलिब्रिटीज का सरनेम नहीं पता होगा आपको
3992,इन 6 में से कोई भी एक नौकरी करने वाले लोग रातोंरात हो सकते हैं मालामाल
3856,इन 8 तरीकों से आप बन सकते हैं बेहतरीन और समझदार कुक !
3188,इन आसान उपायों से आपके टेढ़े-मेढ़े अंदर दांत हो जाएंगे सीधे 
3670,इन आसान तरीकों से आप 10 से 12 घंटे लगातार काम करके भी रह सकते हैं एकदम फिट !
3902,इन टीनएजर्स ने साबित कर दिया स्टार्टअप बच्चों का खेल है
3416,इन देशों में करोड़पति आते हैं और अरबपति बनकर जाते हैं !
3582,इन पांच कारणों से अमीर बनते जाते हैं और भी अमीर !
422320,From 6 Run-Outs To Dhawan's 1000 Runs. The Records India Have Broken At Champions Trophy
408586,From Its Teaser Babumoshai Bandookbaaz Looks Like Another Superb Film That'll Sadly Get Censored
398854,From The 12th Man To Mr Dependable: The Untold Story Of Ajinkya Rahane
446310,Gambhir gets suspended ban for coach spat
367350,Gautam Gambhir Files A Legal Case Against A Resto Bar For Using His Name! Check Out Details
429687,Good news on bad loans: RBI identifies 12 defaulters asks banks to start bankruptcy proceedings
439420,Google CEO Sundar Pichai And His Wife Anjali Pichai&#8217;s Cute Love-Story Prove That True Love Exist!
444167,Gorkhaland stir turns violent: First death reported in Darjeeling cops and GJM trade blame&#8201;after clashes
348279,Government Has Just Banned Serving Food Around Smoking Areas Of Hotels Restaurants
384347,Govt bans 32 private medical colleges from admitting students for two years
430626,Govt May 'Corporatise' Three Key Institutes Including FTII. This Is What It Means
286440,Govt To Spend A Massive Rs 11000 Cr For Improving Road Connectivity In Naxal-Hit Areas
342279,Greater Noida 'gang rape' murder: Death has haunted family for last 5 years
420995,GST Rates Revised: Movie Tickets Insulin Will Be Cheaper
421577,Gujarat Ministers Enjoy Black Magic Show Call It 'Divine Worship'
422321,Gujarat Student Writes Sexual Fantasies For Every Answer In Class 12 Chemistry Paper Leaves Teachers Scandalised
375363,Gurgaon May Turn Into 'Living Hell' Suggests Report
412658,Gurgaon Police Arrests Son Of A Delhi Police Officer For Raping A Widow & Her Daughter
407155,Gurugram girl skips placements to turn full-time YouTuber
442959,Happy Birthday Imtiaz Ali: These dialogues from his films are evergreen
362105,Happy Birthday Paresh Rawal: Hera Pheri to Andaz Apna Apna 10 films which we cannot imagine without him
426689,Has Rajinikanth-Akshay Kumar's 2.0 made Rs 200 crore even before its release?
432006,Hasan Ali stars as Pakistan crush England to reach final
7462,Health Benefits of Wine A Glass Of Wine Can Keep The Doctor Away
408400,Here Are 2 Beneficial Scalp Detox Recipes That'll Boost Your Hair Growth!
333206,Here Are All The Photos From Zaheer Khan & Sagarika Ghatge's Engagement Party
417813,Here's how Salman Khan took credit for Katrina Kaif's career
370542,Here's What Gulshan Grover Said About Shooting Intimate Scenes With Katrina Kaifa
164753,Here's Why A Healthy Diet May Not Always Work
421474,Here's Why Ranbir Kapoor Will Not Have An Arranged Marriage
285031,Here's why Sachin Tendulkar thinks Aamir Khan would've been perfect to play him in the biopic
434804,Here's Why Vivek Oberoi Will Not Do Sex Comedies Again
106729,Here's Why You Shouldn't Skip Having Milk: 12 Health Benefits You Must Know
390128,Here&#8217;s What Emraan Hashmi GIFTS His Wife Every Time He Kisses On Screen!
389147,Hey Ranbir Ranveer Sidharth Varun and Arjun here's how you would look in guy rompers!
362577,Hindi Medium Scores More Than Half Girlfriend On Its 2nd Monday At The Box Office
430818,HMD Global Announces The Nokia 3 5 & 6 Smartphones For India & Here Are All The Details
353465,How To Lose Weight After Child Birth
394701,Hrithik Roshan signs his first BIOPIC read details about his NEXT film!
440351,Hrithik Roshan to turn producer with the biopic on Mathematician Anand Kumar?
356895,Huge Online Search For Missing Chennai Model Gaanam Nair
358495,Huma Qureshi & Nana Patekar Join Rajinikanth's Kaala Karikaalan Cast
389151,I Am Reading Upanishads Gita To Take On RSS BJP: Rahul Gandhi
374913,I cannot recall a time when Muslims were suspected en masse of being unpatriotic': Naseeruddin Shah
379856,I Went To GB Road After Dark. The Sex Workers There Protected Me From Men Trying To Get Handsy
370750,IAF Declares Two Pilots Dead Five Days After Crashed Sukhoi Jet Was Found In Assam
361755,IAS Officer Jumped Into Delhi Pool To Save Woman Colleague Drowns
415639,ICC Champions Trophy 2017: Kohli didn't want Ashwin in squad?
416819,ICC Champions Trophy: India under pressure for semis race in 'group of death'
376401,ICC Champions Trophy: Mohammad Azharuddin Takes A Dig At Yuvraj Singh Ahead Of Pakistan Clash
420999,ICC Champions Trophy: Virat Kohli's pep talk helped India overcome fielding blues
329200,ICC to review security in wake of Manchester bombing
434594,If Guys Had Periods... This Will Make Every Girl Laugh!!
365976,IIT Madras Student Allegedly Thrashed By Sangh Parivar Supporters For Leading 'Beef Fest'
417802,IIT-JEE Advanced Results Are Out Chandigarh Boy Sarvesh Mehtani Is All India Topper
362367,In Babri Case LK Advani Others Get Bail Ask Court Not To Frame Charges
361423,In Babri Masjid Case Framing Of Charges Against LK Advani Other Leaders Today
445117,In previous government no one considered PM as PM; Modi changed that: Amit Shah
352865,In UP 14 Men Molest 2 Women. They Make A Video And Post It Online
309419,In Uttar Pradesh No Fuel To Bikers Who Ride In Without Helmets From May 21
380065,Incredible Bihar! Arts Topper Is 41- YO With Two Kids Gets Arrested For Fraud
445680,India Are Brilliant But Here's Why They Need To Beware Of Pakistan In Champions Trophy Final
